{
  "schema_version": 2,
  "profile_id": "hellfire-dk-speed",
  "version": 3,
  "status": "draft",
  "scope": {
    "route_scope": "Hellfire Peninsula",
    "character_profile": "dk-twohand-blood-current",
    "game_variant_id": "timewalking-wotlk-cn",
    "primary_zone_id": 3483
  },
  "entry_requirements": {
    "active_task_ids": []
  },
  "goal": {
    "summary": "从黑暗之门进入地狱火半岛，按当前DK加速路线完成正式任务集合并进入赞加。"
  },
  "display": {
    "publish_key": "hellfire_dk",
    "order": 2,
    "title": "地狱火半岛 · DK专用加速路线",
    "display_name": "地狱火半岛（DK专用）",
    "subtitle": "黑暗之门起步，依次完成东部前线、断背/塞斯高、萨尔玛北线、猎鹰/塞纳里奥任务簇，最后直接进入赞加。",
    "footer": "塞纳里奥哨站接《塞纳里奥远征队》后直接越境赞加；下一张切换“赞加沼泽（DK专用）”。",
    "map_image": "maps/3483-hellfire-peninsula-hd.jpg"
  },
  "task_ids": [
    9407,
    10120,
    10289,
    10291,
    10121,
    9498,
    10123,
    10124,
    10208,
    10129,
    10162,
    10388,
    10220,
    10809,
    10229,
    10230,
    10792,
    10813,
    10250,
    10834,
    10258,
    9400,
    10390,
    10236,
    10238,
    10393,
    10391,
    10392,
    9401,
    10136,
    10389,
    9405,
    9410,
    9406,
    9340,
    10103,
    9466,
    9366,
    9374,
    9387,
    10442,
    9373,
    10367,
    10368,
    10369,
    9391,
    9370,
    10286,
    10287,
    9472,
    10132,
    10159,
    9912,
    10134,
    10349,
    10351
  ],
  "actions": [
    {
      "kind": "location",
      "location_ref": "hellfire-dk-entry-orgrimmar",
      "action_id": "a0001"
    },
    {
      "kind": "fixed_transport",
      "location_ref": "hellfire-dk-entry-blasted",
      "from_name": "奥格瑞玛·精神谷传送门区",
      "to_name": "诅咒之地·黑暗之门前",
      "action_id": "a0002"
    },
    {
      "kind": "location",
      "location_ref": "hellfire-dk-entry-blasted",
      "action_id": "visit-entry-blasted"
    },
    {
      "kind": "accept",
      "task_id": 9407,
      "location_ref": "hellfire-dk-entry-blasted",
      "npc_name": "督军达图恩",
      "action_id": "a0003"
    },
    {
      "kind": "fixed_transport",
      "location_ref": "hellfire-dk-p001",
      "from_name": "诅咒之地·黑暗之门",
      "to_name": "外域·黑暗之门",
      "action_id": "a0004"
    },
    {
      "kind": "location",
      "location_ref": "hellfire-dk-p001",
      "action_id": "visit-entry-outland"
    },
    {
      "kind": "turnin",
      "task_id": 9407,
      "location_ref": "hellfire-dk-p001",
      "npc_name": "沃雷恩中将",
      "action_id": "a0005"
    },
    {
      "kind": "accept",
      "task_id": 10120,
      "location_ref": "hellfire-dk-p001",
      "npc_name": "沃雷恩中将",
      "action_id": "a0006"
    },
    {
      "kind": "location",
      "location_ref": "hellfire-dk-p002",
      "action_id": "a0007"
    },
    {
      "kind": "turnin",
      "task_id": 10120,
      "location_ref": "hellfire-dk-p002",
      "npc_name": "维拉加·乱羽",
      "action_id": "a0008"
    },
    {
      "kind": "accept",
      "task_id": 10289,
      "location_ref": "hellfire-dk-p002",
      "npc_name": "维拉加·乱羽",
      "action_id": "a0009"
    },
    {
      "kind": "quest_transport",
      "location_ref": "hellfire-dk-p002",
      "from_name": "黑暗之门",
      "to_name": "萨尔玛",
      "action_id": "a0010"
    },
    {
      "kind": "location",
      "location_ref": "hellfire-dk-p003",
      "action_id": "a0011"
    },
    {
      "kind": "turnin",
      "task_id": 10289,
      "location_ref": "hellfire-dk-p003",
      "npc_name": "克拉库克将军",
      "action_id": "a0012"
    },
    {
      "kind": "accept",
      "task_id": 10291,
      "location_ref": "hellfire-dk-p003",
      "npc_name": "克拉库克将军",
      "action_id": "a0013"
    },
    {
      "kind": "turnin",
      "task_id": 10291,
      "location_ref": "hellfire-dk-p003",
      "npc_name": "纳兹格雷尔",
      "action_id": "a0014"
    },
    {
      "kind": "accept",
      "task_id": 10121,
      "location_ref": "hellfire-dk-p003",
      "npc_name": "纳兹格雷尔",
      "action_id": "a0015"
    },
    {
      "kind": "accept",
      "task_id": 9498,
      "location_ref": "hellfire-dk-p003",
      "npc_name": "玛提克·托塞多雷",
      "action_id": "a0016"
    },
    {
      "kind": "open_flight_point",
      "location_ref": "hellfire-dk-p003",
      "target_name": "萨尔玛",
      "action_id": "a0017"
    },
    {
      "kind": "bind_hearth",
      "location_ref": "hellfire-dk-p003",
      "target_name": "萨尔玛",
      "action_id": "a0018"
    },
    {
      "kind": "location",
      "location_ref": "hellfire-dk-p004",
      "action_id": "a0019"
    },
    {
      "kind": "turnin",
      "task_id": 10121,
      "location_ref": "hellfire-dk-p004",
      "npc_name": "斯古尔·碎颅者中士",
      "action_id": "a0020"
    },
    {
      "kind": "accept",
      "task_id": 10123,
      "location_ref": "hellfire-dk-p004",
      "npc_name": "斯古尔·碎颅者中士",
      "action_id": "a0021"
    },
    {
      "kind": "location",
      "location_ref": "hellfire-dk-p005",
      "action_id": "a0022"
    },
    {
      "kind": "objective",
      "task_id": 10123,
      "location_ref": "hellfire-dk-p005",
      "action_id": "a0023"
    },
    {
      "kind": "location",
      "location_ref": "hellfire-dk-p006",
      "action_id": "a0024"
    },
    {
      "kind": "turnin",
      "task_id": 10123,
      "location_ref": "hellfire-dk-p006",
      "npc_name": "斯古尔·碎颅者中士",
      "action_id": "a0025"
    },
    {
      "kind": "accept",
      "task_id": 10124,
      "location_ref": "hellfire-dk-p006",
      "npc_name": "斯古尔·碎颅者中士",
      "action_id": "a0026"
    },
    {
      "kind": "location",
      "location_ref": "hellfire-dk-p007",
      "action_id": "a0027"
    },
    {
      "kind": "turnin",
      "task_id": 10124,
      "location_ref": "hellfire-dk-p007",
      "npc_name": "前线指挥官托尔克",
      "action_id": "a0028"
    },
    {
      "kind": "accept",
      "task_id": 10208,
      "location_ref": "hellfire-dk-p007",
      "npc_name": "前线指挥官托尔克",
      "action_id": "a0029"
    },
    {
      "kind": "location",
      "location_ref": "hellfire-dk-p008",
      "action_id": "a0030"
    },
    {
      "kind": "objective",
      "task_id": 10208,
      "location_ref": "hellfire-dk-p008",
      "action_id": "a0031"
    },
    {
      "kind": "location",
      "location_ref": "hellfire-dk-p009",
      "action_id": "a0032"
    },
    {
      "kind": "turnin",
      "task_id": 10208,
      "location_ref": "hellfire-dk-p009",
      "npc_name": "前线指挥官托尔克",
      "action_id": "a0033"
    },
    {
      "kind": "accept",
      "task_id": 10129,
      "location_ref": "hellfire-dk-p009",
      "npc_name": "前线指挥官托尔克",
      "action_id": "a0034"
    },
    {
      "kind": "location",
      "location_ref": "hellfire-dk-p010",
      "action_id": "a0035"
    },
    {
      "kind": "interact",
      "location_ref": "hellfire-dk-p010",
      "target_name": "乘任务飞行",
      "npc_name": "空军指挥官布拉克",
      "action_id": "a0036"
    },
    {
      "kind": "objective",
      "task_id": 10129,
      "location_ref": "hellfire-dk-p010",
      "action_id": "a0037"
    },
    {
      "kind": "location",
      "location_ref": "hellfire-dk-p011",
      "action_id": "a0038"
    },
    {
      "kind": "turnin",
      "task_id": 10129,
      "location_ref": "hellfire-dk-p011",
      "npc_name": "前线指挥官托尔克",
      "action_id": "a0039"
    },
    {
      "kind": "accept",
      "task_id": 10162,
      "location_ref": "hellfire-dk-p011",
      "npc_name": "前线指挥官托尔克",
      "action_id": "a0040"
    },
    {
      "kind": "location",
      "location_ref": "hellfire-dk-p012",
      "action_id": "a0041"
    },
    {
      "kind": "interact",
      "location_ref": "hellfire-dk-p012",
      "target_name": "乘任务飞行",
      "npc_name": "空军指挥官布拉克",
      "action_id": "a0042"
    },
    {
      "kind": "objective",
      "task_id": 10162,
      "location_ref": "hellfire-dk-p012",
      "action_id": "a0043"
    },
    {
      "kind": "location",
      "location_ref": "hellfire-dk-p013",
      "action_id": "a0044"
    },
    {
      "kind": "turnin",
      "task_id": 10162,
      "location_ref": "hellfire-dk-p013",
      "npc_name": "前线指挥官托尔克",
      "action_id": "a0045"
    },
    {
      "kind": "accept",
      "task_id": 10388,
      "location_ref": "hellfire-dk-p013",
      "npc_name": "前线指挥官托尔克",
      "action_id": "a0046"
    },
    {
      "kind": "location",
      "location_ref": "hellfire-dk-p014",
      "action_id": "a0047"
    },
    {
      "kind": "open_flight_point",
      "location_ref": "hellfire-dk-p014",
      "target_name": "断背岗哨",
      "action_id": "a0048"
    },
    {
      "kind": "accept",
      "task_id": 10220,
      "location_ref": "hellfire-dk-p014",
      "npc_name": "莫迪巴大使",
      "action_id": "a0049"
    },
    {
      "kind": "accept",
      "task_id": 10809,
      "location_ref": "hellfire-dk-p014",
      "npc_name": "通缉布告",
      "action_id": "a0050"
    },
    {
      "kind": "location",
      "location_ref": "hellfire-dk-p015",
      "action_id": "a0051"
    },
    {
      "kind": "objective",
      "task_id": 10220,
      "location_ref": "hellfire-dk-p015",
      "action_id": "a0052"
    },
    {
      "kind": "accept",
      "task_id": 10229,
      "location_ref": "hellfire-dk-p015",
      "target_name": "神秘典籍",
      "when": {
        "kind": "has_item",
        "item_name": "神秘的典籍"
      },
      "action_id": "a0053"
    },
    {
      "kind": "location",
      "location_ref": "hellfire-dk-p016",
      "action_id": "a0054"
    },
    {
      "kind": "objective",
      "task_id": 10809,
      "location_ref": "hellfire-dk-p016",
      "action_id": "a0055"
    },
    {
      "kind": "location",
      "location_ref": "hellfire-dk-p017",
      "action_id": "a0056"
    },
    {
      "kind": "turnin",
      "task_id": 10220,
      "location_ref": "hellfire-dk-p017",
      "npc_name": "莫迪巴大使",
      "action_id": "a0057"
    },
    {
      "kind": "turnin",
      "task_id": 10229,
      "location_ref": "hellfire-dk-p017",
      "npc_name": "史学家奥尔森",
      "when": {
        "kind": "task_active",
        "task_id": 10229
      },